{
  "$schema": "https://json-schema.org/draft/2020-12/schema",
  "$id": "https://codex-orchestrator/schemas/host-config-v1.json",
  "title": "Codex Orchestrator host wrapper config v1",
  "type": "object",
  "additionalProperties": false,
  "required": ["schema_version", "engine", "issued_at", "orchestrator", "host", "engine_options", "wrapper"],
  "properties": {
    "schema_version": { "type": "integer", "const": 1 },
    "engine": { "type": "string", "enum": ["codex", "claude", "grok"] },
    "issued_at": { "type": "string", "format": "date-time" },
    "expires_at": { "type": ["string", "null"], "format": "date-time" },
    "orchestrator": {
      "type": "object",
      "additionalProperties": false,
      "required": ["base_url", "api_key", "installation_id"],
      "properties": {
        "base_url": { "type": "string", "format": "uri" },
        "api_key": { "type": "string", "minLength": 8 },
        "ca_bundle_path": { "type": ["string", "null"] },
        "allow_insecure": { "type": "boolean", "default": false },
        "communicator_protocol": { "type": "integer", "enum": [1] },
        "communicator_sync_protocol": { "type": "integer", "enum": [1] },
        "communicator_state_protocol": { "type": "integer", "enum": [1] },
        "communicator_runtime_protocol": { "type": "integer", "enum": [1] },
        "communicator_cache_protocol": { "type": "integer", "enum": [1] },
        "communicator_update_protocol": { "type": "integer", "enum": [1] },
        "installation_id": { "type": "string" }
      }
    },
    "host": {
      "type": "object",
      "additionalProperties": false,
      "required": ["id", "fqdn", "secure"],
      "properties": {
        "id": { "type": "integer", "minimum": 1 },
        "fqdn": { "type": "string", "minLength": 1 },
        "secure": { "type": "boolean" },
        "browseros_mcp_enabled": { "type": "boolean", "default": false },
        "agent_messaging_enabled": { "type": "boolean", "default": false },
        "engines": { "type": "string" },
        "engines_list": { "type": "array", "items": { "type": "string", "enum": ["codex", "claude", "grok"] } },
        "fleet_disabled_engines": { "type": "array", "items": { "type": "string", "enum": ["codex", "claude", "grok"] } },
        "destroy_engines": {
          "type": "array",
          "items": {
            "type": "object",
            "additionalProperties": false,
            "required": ["engine", "request_id"],
            "properties": {
              "engine": { "type": "string", "enum": ["codex", "claude", "grok"] },
              "request_id": { "type": "string", "minLength": 1 }
            }
          }
        }
      }
    },
    "engine_options": {
      "type": "object",
      "additionalProperties": false,
      "properties": {
        "silent": { "type": "boolean", "default": false },
        "model_override": { "type": ["string", "null"] },
        "reasoning_effort_override": { "type": ["string", "null"], "enum": [null, "minimal", "low", "medium", "high", "xhigh", "max", "ultra"] },
        "admin_theme_hint": { "type": ["string", "null"], "enum": [null, "auto", "light", "dark"] },
        "claude_model_override": { "type": ["string", "null"] },
        "grok_model_override": { "type": ["string", "null"] },
        "grok_reasoning_effort_override": { "type": ["string", "null"], "enum": [null, "low", "medium", "high", "xhigh"] },
        "dangerously_bypass_approvals_and_sandbox": { "type": "boolean", "default": false },
        "model_policy": {
          "type": "object",
          "additionalProperties": false,
          "required": ["engine", "latest_only", "latest_models", "replacements"],
          "properties": {
            "engine": { "type": "string", "enum": ["codex", "claude", "grok"] },
            "latest_only": { "type": "boolean" },
            "latest_models": { "type": "array", "items": { "type": "string" } },
            "replacements": { "type": "object", "additionalProperties": { "type": "string" } },
            "disabled_models": { "type": "array", "items": { "type": "string" } }
          }
        },
        "model_catalog": {
          "type": "object",
          "additionalProperties": false,
          "required": ["default_model", "models"],
          "properties": {
            "default_model": { "type": "string", "minLength": 1 },
            "models": {
              "type": "array",
              "items": {
                "type": "object",
                "additionalProperties": false,
                "required": ["model", "efforts", "session_efforts", "default_effort"],
                "properties": {
                  "model": { "type": "string", "minLength": 1 },
                  "efforts": { "type": "array", "items": { "type": "string" } },
                  "session_efforts": { "type": "array", "items": { "type": "string" } },
                  "default_effort": { "type": ["string", "null"] },
                  "min_cli_version": { "type": "string", "minLength": 1 }
                }
              }
            },
            "min_cli_versions": {
              "type": "object",
              "description": "Native CLI floor per known model id, including ids omitted from models for an old observed CLI. Additive; absent when no model has a floor.",
              "additionalProperties": { "type": "string", "minLength": 1 }
            },
            "live_catalog_models": {
              "type": "array",
              "description": "Unverified models, offered only when the host's native model catalog lists the id. Additive; older wrappers ignore it.",
              "items": {
                "type": "object",
                "additionalProperties": false,
                "required": ["model", "efforts", "session_efforts", "default_effort"],
                "properties": {
                  "model": { "type": "string", "minLength": 1 },
                  "efforts": { "type": "array", "items": { "type": "string" } },
                  "session_efforts": { "type": "array", "items": { "type": "string" } },
                  "default_effort": { "type": ["string", "null"] },
                  "min_cli_version": { "type": "string", "minLength": 1 }
                }
              }
            }
          }
        }
      }
    },
    "session_housekeeping": {
      "type": "object", "additionalProperties": false,
      "required": ["enabled", "retention_days", "max_bytes", "min_age_days"],
      "properties": {
        "enabled": { "type": "boolean" },
        "retention_days": { "type": "integer", "minimum": 1, "maximum": 3650 },
        "max_bytes": { "type": "integer", "minimum": 1048576, "maximum": 1099511627776 },
        "min_age_days": { "type": "integer", "minimum": 1, "maximum": 3650 }
      }
    },
    "agent_messaging": {
      "type": "object",
      "additionalProperties": false,
      "required": ["enabled", "relay_poll_seconds", "queued_ttl_seconds", "channel_preview_enabled", "listen_enabled"],
      "properties": {
        "enabled": { "type": "boolean", "default": false },
        "relay_poll_seconds": { "type": "integer", "minimum": 1, "maximum": 25 },
        "queued_ttl_seconds": { "type": "integer", "minimum": 60, "maximum": 604800 },
        "channel_preview_enabled": { "type": "boolean", "default": false },
        "receiver_enabled": { "type": "boolean", "default": false },
        "capacity_continue_enabled": { "type": "boolean", "default": false },
        "listen_enabled": { "type": "boolean", "default": false }
      }
    },
    "wrapper": {
      "type": "object",
      "additionalProperties": false,
      "required": ["version", "track", "auto_update", "binary_url", "binary_sha256"],
      "properties": {
        "version": { "type": "string", "minLength": 1 },
        "track": { "type": "string", "enum": ["stable", "beta", "dev"] },
        "auto_update": { "type": "boolean" },
        "binary_url": { "type": "string", "format": "uri" },
        "binary_sha256": { "type": "string", "pattern": "^[0-9a-f]{64}$" }
      }
    },
    "documents": {
      "type": "object",
      "additionalProperties": false,
      "properties": {
        "agents": {
          "type": ["object", "null"],
          "additionalProperties": false,
          "required": ["id", "sha256"],
          "properties": {
            "id": { "type": "integer", "minimum": 1 },
            "sha256": { "type": "string", "pattern": "^[0-9a-f]{64}$" }
          }
        },
        "client_config": {
          "type": ["object", "null"],
          "additionalProperties": false,
          "required": ["id", "sha256"],
          "properties": {
            "id": { "type": "integer", "minimum": 1 },
            "sha256": { "type": "string", "pattern": "^[0-9a-f]{64}$" }
          }
        }
      }
    },
    "skills": {
      "type": "array",
      "items": {
        "type": "object",
        "additionalProperties": false,
        "required": ["slug", "sha256"],
        "properties": {
          "slug": { "type": "string", "minLength": 1 },
          "sha256": { "type": "string", "pattern": "^[0-9a-f]{64}$" }
        }
      }
    },
    "config_version": { "type": "integer", "minimum": 0 },
    "etag": { "type": "string", "pattern": "^[0-9a-f]{64}$" }
  }
}
