{"agent_messaging":{"capacity_continue_enabled":false,"channel_preview_enabled":false,"enabled":false,"listen_enabled":false,"queued_ttl_seconds":86400,"receiver_enabled":false,"relay_poll_seconds":25},"config_version":8,"documents":{"agents":{"id":10,"sha256":"c2c2c2c2c2c2c2c2c2c2c2c2c2c2c2c2c2c2c2c2c2c2c2c2c2c2c2c2c2c2c2c2"},"client_config":{"id":3,"sha256":"d3d3d3d3d3d3d3d3d3d3d3d3d3d3d3d3d3d3d3d3d3d3d3d3d3d3d3d3d3d3d3d3"}},"engine":"claude","engine_options":{"admin_theme_hint":"auto","claude_model_override":"claude-opus-4.7","model_catalog":{"default_model":"claude-sonnet-5","models":[{"default_effort":"high","efforts":["low","medium","high","xhigh"],"model":"claude-fable-5-1","session_efforts":["max"]},{"default_effort":"high","efforts":["low","medium","high","xhigh"],"model":"claude-fable-5","session_efforts":["max"]},{"default_effort":"medium","efforts":["low","medium","high","xhigh"],"model":"claude-opus-5-5","session_efforts":["max"]},{"default_effort":"high","efforts":["low","medium","high","xhigh"],"model":"claude-opus-5","session_efforts":["max"]},{"default_effort":"high","efforts":["low","medium","high","xhigh"],"model":"claude-opus-4-8","session_efforts":["max"]},{"default_effort":"medium","efforts":["low","medium","high","xhigh"],"model":"claude-sonnet-5-5","session_efforts":["max"]},{"default_effort":"high","efforts":["low","medium","high","xhigh"],"model":"claude-sonnet-5","session_efforts":["max"]},{"default_effort":"xhigh","efforts":["low","medium","high","xhigh"],"model":"claude-opus-4-7","session_efforts":["max"]},{"default_effort":"high","efforts":["low","medium","high"],"model":"claude-sonnet-4-6","session_efforts":["max"]},{"default_effort":"high","efforts":["low","medium","high"],"model":"claude-opus-4-6","session_efforts":["max"]},{"default_effort":null,"efforts":[],"model":"claude-opus-4-5-20251101","session_efforts":[]},{"default_effort":"medium","efforts":["low","medium","high","xhigh"],"model":"claude-haiku-5-5","session_efforts":["max"]},{"default_effort":null,"efforts":[],"model":"claude-haiku-4-5-20251001","session_efforts":[]}]},"silent":false},"etag":"b4e7e36eb80d7a0f18d85479ae4a80b9447838f7fb1741a205f128ef0f3b4e99","expires_at":"2026-02-14T00:00:00Z","host":{"agent_messaging_enabled":false,"browseros_mcp_enabled":false,"engines":"claude","engines_list":["claude"],"fqdn":"host-c.fleet.example.com","id":44,"secure":true},"issued_at":"2026-01-15T00:00:00Z","orchestrator":{"allow_insecure":false,"api_key":"sk-golden-claude-not-a-real-key","base_url":"https://orchestrator.example.com","ca_bundle_path":null,"installation_id":"golden-installation-0001"},"schema_version":1,"session_housekeeping":{"enabled":true,"max_bytes":5368709120,"min_age_days":7,"retention_days":30},"skills":[{"sha256":"e4e4e4e4e4e4e4e4e4e4e4e4e4e4e4e4e4e4e4e4e4e4e4e4e4e4e4e4e4e4e4e4","slug":"fleet-bootstrap"},{"sha256":"a6a6a6a6a6a6a6a6a6a6a6a6a6a6a6a6a6a6a6a6a6a6a6a6a6a6a6a6a6a6a6a6","slug":"claude-artifacts"}],"wrapper":{"auto_update":true,"binary_sha256":"b1b1b1b1b1b1b1b1b1b1b1b1b1b1b1b1b1b1b1b1b1b1b1b1b1b1b1b1b1b1b1b1","binary_url":"https://orchestrator.example.com/wrapper/v2/bin/cxx/linux-amd64/v2.4.0/cxx","track":"stable","version":"2.4.0"}}