{"agent_messaging":{"channel_preview_enabled":false,"enabled":true,"listen_enabled":true,"queued_ttl_seconds":86400,"receiver_enabled":true,"relay_poll_seconds":25},"config_version":5,"documents":{"agents":{"id":10,"sha256":"c2c2c2c2c2c2c2c2c2c2c2c2c2c2c2c2c2c2c2c2c2c2c2c2c2c2c2c2c2c2c2c2"},"client_config":null},"engine":"codex","engine_options":{"admin_theme_hint":null,"model_catalog":{"default_model":"gpt-6-astra","models":[{"default_effort":"low","efforts":["low","medium","high","xhigh","max","ultra"],"model":"gpt-6.1-sol","session_efforts":[]},{"default_effort":"medium","efforts":["low","medium","high","xhigh","max","ultra"],"model":"gpt-6-astra","session_efforts":[]},{"default_effort":"medium","efforts":["low","medium","high","xhigh","max","ultra"],"model":"gpt-6-sol","session_efforts":[]},{"default_effort":"medium","efforts":["low","medium","high","xhigh","max"],"model":"gpt-6-luna","session_efforts":[]},{"default_effort":"low","efforts":["low","medium","high","xhigh","max","ultra"],"model":"gpt-5.6-sol","session_efforts":[]},{"default_effort":"medium","efforts":["low","medium","high","xhigh","max","ultra"],"model":"gpt-5.6-terra","session_efforts":[]},{"default_effort":"medium","efforts":["low","medium","high","xhigh","max"],"model":"gpt-5.6-luna","session_efforts":[]}]},"model_override":null,"reasoning_effort_override":null,"silent":true},"etag":"fd8591b18002857ae78f864a22214e69f81c5416f42fef25b28d3c3e398dc196","expires_at":"2026-02-14T00:00:00Z","host":{"agent_messaging_enabled":true,"browseros_mcp_enabled":false,"engines":"codex","engines_list":["codex"],"fqdn":"host-b.fleet.example.com","id":43,"secure":false},"issued_at":"2026-01-15T00:00:00Z","orchestrator":{"allow_insecure":true,"api_key":"sk-golden-insecure-not-a-real-key","base_url":"https://orchestrator.example.com","ca_bundle_path":null,"installation_id":"golden-installation-0001"},"schema_version":1,"session_housekeeping":{"enabled":true,"max_bytes":5368709120,"min_age_days":7,"retention_days":30},"skills":[],"wrapper":{"auto_update":false,"binary_sha256":"b1b1b1b1b1b1b1b1b1b1b1b1b1b1b1b1b1b1b1b1b1b1b1b1b1b1b1b1b1b1b1b1","binary_url":"https://orchestrator.example.com/wrapper/v2/bin/cxx/linux-amd64/v2.4.0/cxx","track":"beta","version":"2.4.0"}}