{"agent_messaging":{"channel_preview_enabled":false,"enabled":true,"listen_enabled":true,"queued_ttl_seconds":86400,"receiver_enabled":true,"relay_poll_seconds":25},"config_version":12,"documents":{"agents":{"id":10,"sha256":"c2c2c2c2c2c2c2c2c2c2c2c2c2c2c2c2c2c2c2c2c2c2c2c2c2c2c2c2c2c2c2c2"},"client_config":{"id":3,"sha256":"d3d3d3d3d3d3d3d3d3d3d3d3d3d3d3d3d3d3d3d3d3d3d3d3d3d3d3d3d3d3d3d3"}},"engine":"codex","engine_options":{"admin_theme_hint":"dark","model_override":"gpt-5.4-codex","reasoning_effort_override":"high","silent":false},"etag":"5e52f60a54a728e227f25686ec487086eaaa9179b974e589dfba9be04c2ec830","expires_at":"2026-02-14T00:00:00Z","host":{"agent_messaging_enabled":true,"browseros_mcp_enabled":true,"engines":"codex,claude","engines_list":["codex","claude"],"fqdn":"host-a.fleet.example.com","id":42,"secure":true},"issued_at":"2026-01-15T00:00:00Z","orchestrator":{"allow_insecure":false,"api_key":"sk-golden-codex-not-a-real-key","base_url":"https://orchestrator.example.com","ca_bundle_path":null,"installation_id":"golden-installation-0001"},"schema_version":1,"session_housekeeping":{"enabled":true,"max_bytes":5368709120,"min_age_days":7,"retention_days":30},"skills":[{"sha256":"e4e4e4e4e4e4e4e4e4e4e4e4e4e4e4e4e4e4e4e4e4e4e4e4e4e4e4e4e4e4e4e4","slug":"fleet-bootstrap"},{"sha256":"f5f5f5f5f5f5f5f5f5f5f5f5f5f5f5f5f5f5f5f5f5f5f5f5f5f5f5f5f5f5f5f5","slug":"codex-review"}],"wrapper":{"auto_update":true,"binary_sha256":"b1b1b1b1b1b1b1b1b1b1b1b1b1b1b1b1b1b1b1b1b1b1b1b1b1b1b1b1b1b1b1b1","binary_url":"https://orchestrator.example.com/wrapper/v2/bin/cxx/linux-amd64/v2.4.0/cxx","track":"stable","version":"2.4.0"}}