{"agent_messaging":{"channel_preview_enabled":false,"enabled":true,"listen_enabled":true,"queued_ttl_seconds":86400,"receiver_enabled":true,"relay_poll_seconds":25},"config_version":10,"documents":{"agents":{"id":10,"sha256":"c2c2c2c2c2c2c2c2c2c2c2c2c2c2c2c2c2c2c2c2c2c2c2c2c2c2c2c2c2c2c2c2"},"client_config":{"id":3,"sha256":"d3d3d3d3d3d3d3d3d3d3d3d3d3d3d3d3d3d3d3d3d3d3d3d3d3d3d3d3d3d3d3d3"}},"engine":"grok","engine_options":{"admin_theme_hint":"auto","grok_model_override":"grok-4.6","grok_reasoning_effort_override":"xhigh","model_catalog":{"default_model":"grok-4.7","models":[{"default_effort":"high","efforts":["low","medium","high","xhigh"],"model":"grok-4.7","session_efforts":[]},{"default_effort":"high","efforts":["low","medium","high","xhigh"],"model":"grok-4.7-build-fast","session_efforts":[]},{"default_effort":"high","efforts":["low","medium","high","xhigh"],"model":"grok-4.6","session_efforts":[]},{"default_effort":"high","efforts":["low","medium","high"],"model":"grok-4.5","session_efforts":[]}]},"model_override":"grok-4.6","reasoning_effort_override":"xhigh","silent":true},"etag":"f44fc6f8ea964d218904452ada877abd222661ebe8b42360e0788298e10113ae","expires_at":"2026-02-14T00:00:00Z","host":{"agent_messaging_enabled":true,"browseros_mcp_enabled":false,"engines":"codex,claude,grok","engines_list":["codex","claude","grok"],"fqdn":"host-grok.fleet.example.com","id":45,"secure":true},"issued_at":"2026-01-15T00:00:00Z","orchestrator":{"allow_insecure":false,"api_key":"sk-golden-grok-not-a-real-key","base_url":"https://orchestrator.example.com","ca_bundle_path":null,"installation_id":"golden-installation-0001"},"schema_version":1,"session_housekeeping":{"enabled":true,"max_bytes":5368709120,"min_age_days":7,"retention_days":30},"skills":[{"sha256":"e4e4e4e4e4e4e4e4e4e4e4e4e4e4e4e4e4e4e4e4e4e4e4e4e4e4e4e4e4e4e4e4","slug":"fleet-bootstrap"},{"sha256":"e8e8e8e8e8e8e8e8e8e8e8e8e8e8e8e8e8e8e8e8e8e8e8e8e8e8e8e8e8e8e8e8","slug":"grok-build"}],"wrapper":{"auto_update":true,"binary_sha256":"b1b1b1b1b1b1b1b1b1b1b1b1b1b1b1b1b1b1b1b1b1b1b1b1b1b1b1b1b1b1b1b1","binary_url":"https://orchestrator.example.com/wrapper/v2/bin/cxx/linux-amd64/v2.4.0/cxx","track":"stable","version":"2.4.0"}}